{
  "schema_version": "generation_schedule_plan.v0.1",
  "plan_id": "mvp_generation_schedule_plan_v0_1",
  "visibility": "review_only",
  "worldbook_id": "long_night_lanterns",
  "run_id": "demo_run_001",
  "created_at": "2026-07-02T00:00:00Z",
  "authority": {
    "control_plane_only": true,
    "content_truth_owner": "schemas_validators_and_reviewed_packages",
    "schedule_builder_reads_env": false,
    "schedule_builder_calls_provider": false,
    "runtime_world_mutation_allowed": false,
    "activation_requires_revalidation": true
  },
  "source_refs": {
    "architecture_index": "docs/CURRENT_ARCHITECTURE_INDEX.md",
    "ai_compilation_system": "docs/AI_COMPILATION_SYSTEM_V0_1.md",
    "compilable_object_plan": "examples/review_packs/mvp_next_stage_compilable_object_plan.v0.1.json",
    "final_run_state": "examples/run_world_states/demo_after_stage_07_split_tide.run_world_state.json",
    "frontend_mock_pack": "examples/frontend_mock/frontend_mock_pack.v0.1.json",
    "runtime_art_manifest": "game_data/media/frontend_runtime_mock/frontend_runtime_art_media_manifest.v0.1.json",
    "runtime_art_atlas_manifest": "game_data/media/frontend_runtime_mock/frontend_runtime_art_atlas_manifest.v0.1.json",
    "runtime_sprite_repair_plan": "examples/review_packs/frontend_runtime_sprite_cutout_repair_plan.v0.1.json",
    "runtime_sprite_regeneration_promotion_report": "examples/review_packs/frontend_runtime_sprite_regeneration_promotion_report.v0.1.json",
    "map_runtime_packages": [
      "examples/map_runtime_packages/mvp_first_battle.map_runtime_package.json",
      "examples/map_runtime_packages/mvp_old_signal_tower_pressure.map_runtime_package.json",
      "examples/map_runtime_packages/mvp_wick_store_pressure.map_runtime_package.json"
    ],
    "map_compile_packages": [
      "examples/map_compile_packages/mvp_first_battle.map_compile_package.json",
      "examples/map_compile_packages/mvp_old_signal_tower_pressure.map_compile_package.json",
      "examples/map_compile_packages/mvp_wick_store_pressure.map_compile_package.json"
    ]
  },
  "budget_profile": {
    "max_sync_blocking_items": 4,
    "max_parallel_background_items": 2,
    "max_live_provider_items": 1,
    "default_timeout_seconds": 90,
    "retry_policy": {
      "max_attempts_per_item": 2,
      "backoff_seconds": 5
    },
    "degrade_on_budget_exhaustion": true
  },
  "fallback_policy": {
    "player_safe_error_mode": "world_explanation_only",
    "technical_error_visibility": "internal_only",
    "default_fallback_refs": [
      "examples/frontend_mock/frontend_mock_pack.v0.1.json",
      "examples/runtime_packages/mvp_demo.runtime_package.json",
      "game_data/media/frontend_runtime_mock/frontend_runtime_art_atlas_manifest.v0.1.json"
    ]
  },
  "items": [
    {
      "schedule_item_id": "sched_session_frontend_mock_bootstrap",
      "compile_request_id": "compile_session_frontend_mock_bootstrap",
      "object_ref": "frontend_mock_pack:mvp",
      "object_kind": "frontend_mock_pack",
      "purpose": "让新档案、世界实例、大地图、首战和结算主链路在会话开始时立即可用。",
      "latency_class": "sync_blocking",
      "priority": 100,
      "status": "ready",
      "trigger": {
        "mode": "session_start",
        "description": "会话创建后立即加载 reviewed fixture 主链路。"
      },
      "dependencies": [],
      "cache_policy": {
        "cache_key": "frontend_mock_pack:mvp:v0.1",
        "reuse": "always_static",
        "invalidation_refs": [
          "examples/frontend_mock/frontend_mock_pack.v0.1.json"
        ]
      },
      "provider_policy": {
        "mode": "no_live_provider",
        "max_attempts": 0,
        "profile": "offline_fixture"
      },
      "validation_gates": [
        "validate_frontend_mock_pack.py"
      ],
      "fallback_ref": "examples/frontend_mock/frontend_mock_pack.v0.1.json",
      "commit_policy": {
        "world_commit": "none",
        "runtime_activation": "already_active",
        "revalidate_before_activation": true
      },
      "player_visible": true
    },
    {
      "schedule_item_id": "sched_first_battle_map_runtime_package",
      "compile_request_id": "compile_first_battle_map_runtime_package",
      "object_ref": "map_runtime_package:mvp_first_battle",
      "object_kind": "map_runtime_package",
      "purpose": "保证第一场战斗路线、塔位、目标、出生点和发布底图在进入战斗前已经锁定。",
      "latency_class": "sync_blocking",
      "priority": 100,
      "status": "ready",
      "trigger": {
        "mode": "node_visible",
        "description": "第一个战斗节点可见时读取已发布地图运行包。"
      },
      "dependencies": [
        "sched_session_frontend_mock_bootstrap"
      ],
      "cache_policy": {
        "cache_key": "map_runtime_package:mvp_first_battle:v0.1",
        "reuse": "always_static",
        "invalidation_refs": [
          "examples/map_runtime_packages/mvp_first_battle.map_runtime_package.json"
        ]
      },
      "provider_policy": {
        "mode": "no_live_provider",
        "max_attempts": 0,
        "profile": "offline_fixture"
      },
      "validation_gates": [
        "validate_battle_visual_contract.py",
        "validate_map_runtime_package.py"
      ],
      "fallback_ref": "examples/map_runtime_packages/mvp_first_battle.map_runtime_package.json",
      "commit_policy": {
        "world_commit": "none",
        "runtime_activation": "already_active",
        "revalidate_before_activation": true
      },
      "player_visible": true
    },
    {
      "schedule_item_id": "sched_runtime_art_atlas_ready",
      "compile_request_id": "compile_runtime_art_atlas_ready",
      "object_ref": "media_atlas:frontend_runtime_art_atlas_v0_1",
      "object_kind": "media_atlas_manifest",
      "purpose": "保证战斗敌人、目标物、防御件、NPC 头像、地图 token 和特效入口可被前端读取。",
      "latency_class": "sync_blocking",
      "priority": 98,
      "status": "ready",
      "trigger": {
        "mode": "battle_started",
        "description": "战斗场景启动前读取 published runtime art manifest 与 atlas。"
      },
      "dependencies": [
        "sched_first_battle_map_runtime_package"
      ],
      "cache_policy": {
        "cache_key": "media_atlas:frontend_runtime_art_atlas_v0_1",
        "reuse": "reuse_if_inputs_match",
        "invalidation_refs": [
          "game_data/media/frontend_runtime_mock/frontend_runtime_art_atlas_manifest.v0.1.json",
          "game_data/media/frontend_runtime_mock/frontend_runtime_art_media_manifest.v0.1.json"
        ]
      },
      "provider_policy": {
        "mode": "no_live_provider",
        "max_attempts": 0,
        "profile": "published_runtime_media"
      },
      "validation_gates": [
        "audit_sprite_cutout_quality.py",
        "validate_frontend_runtime_art_pack.py",
        "validate_media_atlas_manifest.py",
        "validate_multiframe_atlas_contract.py"
      ],
      "fallback_ref": "game_data/media/frontend_runtime_mock/frontend_runtime_art_media_manifest.v0.1.json",
      "commit_policy": {
        "world_commit": "none",
        "runtime_activation": "already_active",
        "revalidate_before_activation": true
      },
      "player_visible": true
    },
    {
      "schedule_item_id": "sched_static_fallback_runtime_route",
      "compile_request_id": "compile_static_fallback_runtime_route",
      "object_ref": "runtime_package:mvp_demo",
      "object_kind": "fallback_static",
      "purpose": "当实时生成或后台生成失败时，维持首战、样品和结算可继续游玩。",
      "latency_class": "fallback_static",
      "priority": 96,
      "status": "fallback_ready",
      "trigger": {
        "mode": "battle_started",
        "description": "任何后台内容未按时完成时，继续使用已审运行包与确定性表现。"
      },
      "dependencies": [
        "sched_runtime_art_atlas_ready",
        "sched_session_frontend_mock_bootstrap"
      ],
      "cache_policy": {
        "cache_key": "fallback_static:mvp_demo_runtime",
        "reuse": "always_static",
        "invalidation_refs": [
          "examples/runtime_packages/mvp_demo.runtime_package.json"
        ]
      },
      "provider_policy": {
        "mode": "no_live_provider",
        "max_attempts": 0,
        "profile": "locked_static_fallback"
      },
      "validation_gates": [
        "validate_runtime_package.py"
      ],
      "fallback_ref": "examples/runtime_packages/mvp_demo.runtime_package.json",
      "commit_policy": {
        "world_commit": "none",
        "runtime_activation": "already_active",
        "revalidate_before_activation": true
      },
      "player_visible": true
    },
    {
      "schedule_item_id": "sched_stage05_worldline_prefetch",
      "compile_request_id": "compile_stage05_worldline_prefetch",
      "object_ref": "compilable_object_plan:act_1_stage_05_old_signal_tower_pressure",
      "object_kind": "narrative_world_delta_prefetch",
      "purpose": "在玩家结算和返回大地图前准备下一阶段剧情、任务、随机事件和世界状态变化候选。",
      "latency_class": "background_prefetch",
      "priority": 82,
      "status": "review_only",
      "trigger": {
        "mode": "battle_settlement",
        "description": "首战结算后进入后台预取，只产出候选，启用前重新校验。"
      },
      "dependencies": [
        "sched_static_fallback_runtime_route"
      ],
      "cache_policy": {
        "cache_key": "prefetch:stage05_old_signal_tower:review_only",
        "reuse": "reuse_if_inputs_match",
        "invalidation_refs": [
          "examples/review_packs/mvp_next_stage_compilable_object_plan.v0.1.json",
          "examples/run_world_states/demo_after_stage_07_split_tide.run_world_state.json"
        ]
      },
      "provider_policy": {
        "mode": "allowed_after_review",
        "max_attempts": 2,
        "profile": "llm_world_delta_guarded"
      },
      "validation_gates": [
        "validate_compilable_object_plan.py",
        "validate_narrative_bundle.py",
        "validate_narrative_gameplay_contract.py",
        "validate_world_delta.py",
        "validate_world_delta_semantics.py"
      ],
      "fallback_ref": "examples/review_packs/mvp_next_stage_compilable_object_plan.v0.1.json",
      "commit_policy": {
        "world_commit": "world_delta_semantic_gate",